{
  "$schema": "../../../tools/schemas/sample.tool-payload.schema.json",
  "sampleId": "0510",
  "phase": "05",
  "title": "Asset Loader System",
  "description": "Shared sample preset for Sample 0510 and Asset Pipeline Tool preload.",
  "toolHints": [
    "asset-pipeline-tool"
  ],
  "payload": {
    "pipelinePayload": {
      "gameId": "sample-0510",
      "domainInputs": {
        "sprites": [
          {
            "assetId": "sample-0510-player-sheet",
            "runtimeFileName": "sample-0510-player-sheet.runtime.json",
            "toolDataFileName": "sample-0510-player-sheet.tool.json",
            "sourceToolId": "sprite-editor"
          }
        ],
        "tilemaps": [
          {
            "assetId": "sample-0510-level-grid",
            "runtimeFileName": "sample-0510-level-grid.runtime.json",
            "toolDataFileName": "sample-0510-level-grid.tool.json",
            "sourceToolId": "tile-map-editor"
          }
        ]
      },
      "toolStates": {
        "asset-pipeline-tool": {
          "schema": "html-js-gaming.tool-state",
          "version": 1,
          "toolId": "asset-pipeline-tool",
          "projectId": "sample-0510",
          "savedAtIso": "2026-04-24T00:00:00.000Z",
          "state": {
            "mode": "build"
          }
        }
      }
    }
  },
  "runtime": {
    "sampleEntryPoint": "/samples/phase-05/0510/index.html"
  },
  "toolState": {
    "preferredToolId": "asset-pipeline-tool"
  },
  "provenance": {
    "path": "/samples/phase-05/0510/sample-0510-asset-pipeline-tool.json",
    "createdAt": "2026-04-24T00:00:00.000Z",
    "version": 1
  }
}
