{
  "$schema": "../../../tools/schemas/sample.tool-payload.schema.json",
  "sampleId": "0305",
  "phase": "03",
  "title": "Tile Metadata",
  "description": "Shared sample preset for Sample 0305 and 3D JSON Payload Normalizer preload.",
  "toolHints": [
    "3d-json-payload-normalizer"
  ],
  "payload": {
    "mapPayload": {
      "schema": "tools.3d-json-payload-normalizer.document/1",
      "mapId": "sample-0305-tile-metadata-loop",
      "points": [
        {
          "id": "p1",
          "x": -22,
          "y": 0,
          "z": -8
        },
        {
          "id": "p2",
          "x": 22,
          "y": 0,
          "z": -8
        },
        {
          "id": "p3",
          "x": 24,
          "y": 0,
          "z": 12
        },
        {
          "id": "p4",
          "x": -24,
          "y": 0,
          "z": 12
        },
        {
          "id": "p5",
          "x": 0,
          "y": 0,
          "z": 22
        }
      ],
      "segments": [
        {
          "from": "p1",
          "to": "p2"
        },
        {
          "from": "p2",
          "to": "p3"
        },
        {
          "from": "p3",
          "to": "p4"
        },
        {
          "from": "p4",
          "to": "p1"
        },
        {
          "from": "p2",
          "to": "p5"
        }
      ]
    }
  },
  "runtime": {
    "sampleEntryPoint": "/samples/phase-03/0305/index.html"
  },
  "toolState": {
    "preferredToolId": "3d-json-payload-normalizer"
  },
  "provenance": {
    "path": "/samples/phase-03/0305/sample-0305-3d-json-payload-normalizer.json",
    "createdAt": "2026-04-24T00:00:00.000Z",
    "version": 1
  }
}
